[
    {   
        "name": "Simple Request",
        "description": "A simple request to the service to demonstrate basic functionality.",
        "target": "http://localhost:3000",
        "startDelaySeconds": 8,
        "body": [
            {
                "type": "log",
                "message": "Waiting 0,5 seconds before starting the request"
            },
            {
                "type": "wait",
                "duration": 500
            },
            {
                "type": "log",
                "message": "The 0,5 seconds wait is over, sending a request to other service"
            },
            {
                "type": "http",
                "url": "http://localhost:3001/api/v1/execute",
                "await": false,
                "body": [
                    {
                        "type": "log",
                        "message": "Recieved a request, wait 1 second before processing"
                    },
                    {
                        "type": "wait",
                        "duration": 1000
                    },
                    {
                        "type": "return",
                        "data": { "status": "success", "message": "Request processed successfully" }
                    },
                    {
                        "type": "log",
                        "message": "Request processed and response sent back"
                    }
                ]
            },
            {
                "type": "log",
                "message": "This is after the async request"
            }
        ]
    },
    {
        "name": "Generate SLA Report",
        "description": "A complex request to the Reporter service that involves multiple microservices to generate a SLA report.",
        "target": "http://localhost:3000",
        "startDelaySeconds": 15,
        "body": [
            {
                "type": "log",
                "message": "User clicked Generate Report â€“ Reporter (M1)"
            },
            {
                "type": "log",
                "message": "Reporter (M1) checking for user authorization"
            },
            {
                "type": "http",
                "url": "http://localhost:3001/api/v1/execute",
                "body": [
                    {
                        "type": "log",
                        "message": "AuthService (M2) validating user"
                    },
                    {
                        "type": "log",
                        "message": "AuthService (M2) user is authorized"
                    }
                ]
            },
            {
                "type": "log",
                "message": "The user is authorized"
            },
            {
                "type": "log",
                "message": "Reporter checking for existing SLA chart data"
            },
            {
                "type": "code",
                "source": "const dataExists = false; if (dataExists) { logger.warn('Data already exists, skipping Registry'); return 'Chart generated'; } else { logger.info('No existing chart data, proceeding to Registry'); }"
            },
            {
                "type": "http",
                "url": "http://localhost:3002/api/v1/execute",
                "body": [
                    {
                        "type": "log",
                        "message": "A new Report requested, Found 4 active SLA guarantees"
                    },
                    {
                        "type": "log",
                        "message": "Calling CollectorService sequentially for each SLA guarantee"
                    },
                    {
                        "type": "http",
                        "repeat": 4,
                        "url": "http://localhost:3003/api/v1/execute",
                        "body": [
                            {
                                "type": "log",
                                "message": "CollectorService (M4) fetching SLA data"
                            },
                            {
                                "type": "wait",
                                "duration": 700
                            },
                            {
                                "type": "return",
                                "data": [2, 4, 5]
                            }
                        ]
                    },
                    {
                        "type": "log",
                        "message": "CollectorService returned data for all 4 guarantees succesfully, generating final Report"
                    },
                    {
                        "type": "log",
                        "message": "Report complete, sending email to user"
                    },
                    {
                        "type": "http",
                        "url": "http://localhost:3004/api/v1/execute",
                        "body": [
                            {
                                "type": "log",
                                "message": "Sending SLA report to user"
                            },
                            {
                                "type": "log",
                                "message": "Email sent successfully"
                            }
                        ]
                    },
                    {
                        "type": "log",
                        "message": "Returning final SLA report to Reporter"
                    }
                ]
            },
            {
                "type": "log",
                "message": "Received final report from Registry, generating the charts"
            },
            {
                "type": "log",
                "message": "Chart generated and returned to user"
            }
        ]
    }
]